{
  "catalog_id": "io.github.xiaoweikin.engineering-specifications",
  "catalog_version": "1.9.0",
  "schema_version": 1,
  "specs": [
    {
      "applies_to": [
        "**/*"
      ],
      "description": "Load when changing shared names, semantic verbs such as Normalize or Extract, cross-surface mappings, units, states, or naming compatibility",
      "id": "core/semantic-naming",
      "path": "specification/core/semantic-naming.md",
      "required": true,
      "requires": [],
      "sha256": "b190713f27efc11eba59551d4026036d87f30027dd624b17e62d6627e5814c83",
      "version": "1.2.0"
    },
    {
      "applies_to": [
        "**/*"
      ],
      "description": "Load when consuming external data, parsing weak shapes, crossing trust boundaries, or gating effects",
      "id": "core/data-boundaries",
      "path": "specification/core/data-boundaries.md",
      "required": true,
      "requires": [
        "core/semantic-naming"
      ],
      "sha256": "4a6a68d93110ff3853a825ec4ce78d1f8731bd1fe635b7aaa1eccb64a56819e9",
      "version": "0.2.1"
    },
    {
      "applies_to": [
        "**/*"
      ],
      "description": "Load when designing, implementing, refactoring, or reviewing code complexity, common paths, validation, abstractions, or performance",
      "id": "core/implementation-simplicity",
      "path": "specification/core/implementation-simplicity.md",
      "required": true,
      "requires": [],
      "sha256": "271be3ff8bd46a8fdac85da77337252766215cac2de5edcf7c9e09f5c4928a13",
      "version": "0.2.0"
    },
    {
      "applies_to": [
        "**/*.go",
        "**/go.mod",
        "**/go.sum",
        "**/go.work",
        "**/vendor/modules.txt"
      ],
      "description": "Load when changing hand-written Go code, module or generator state, APIs, names, boundaries, lifecycle, or tests",
      "detection": {
        "extensions": [
          ".go"
        ],
        "filenames": [
          "go.mod",
          "go.work"
        ]
      },
      "id": "languages/go",
      "path": "specification/languages/go.md",
      "required": false,
      "requires": [
        "core/semantic-naming",
        "core/data-boundaries"
      ],
      "sha256": "bd10abbd01c98c3efa3b3e1bc1af7aa1b1f611dca0c46724c781e0c9d5d416ef",
      "version": "0.6.0"
    },
    {
      "applies_to": [
        "**/*.go",
        "**/*.s"
      ],
      "description": "Load when diagnosing or changing Go performance, profiles, benchmarks, allocation or GC behavior, or architecture-specific fast paths",
      "id": "languages/go/performance",
      "path": "specification/languages/go/performance.md",
      "required": false,
      "requires": [
        "languages/go"
      ],
      "sha256": "7c1399228a609af8671fa7e8df982ac1a8744cc588ab01de9bec5c4f77b3fe22",
      "version": "0.1.0"
    },
    {
      "applies_to": [
        "**/*.go"
      ],
      "description": "Load when designing, changing, or reviewing Go functional-option APIs, including defaults, application order, conflicts, validation, or migration",
      "id": "languages/go/functional-options",
      "path": "specification/languages/go/functional-options.md",
      "required": false,
      "requires": [
        "languages/go"
      ],
      "sha256": "dfc7660f9663286e1df592b557abb09f1d1f445c1a5d10cc2aa9c0250a8f2d1c",
      "version": "0.2.1"
    },
    {
      "applies_to": [
        "**/*.go"
      ],
      "description": "Load when building or evolving Go capability factories from optional named delegates, including absence, interface evolution, concurrency, or lifecycle",
      "id": "languages/go/factory-delegation",
      "path": "specification/languages/go/factory-delegation.md",
      "required": false,
      "requires": [
        "languages/go/functional-options"
      ],
      "sha256": "f12b2bcfa0f9a74ad8103690ffa3e86c5ff76a6041684bf60f0ad14f0f2e4436",
      "version": "0.2.0"
    },
    {
      "applies_to": [
        "**/*.md",
        "**/*.mdx"
      ],
      "description": "Load when writing or reviewing engineering documentation, procedures, architecture explanations, or evidence-backed technical claims",
      "id": "documentation/technical-documentation",
      "path": "specification/documentation/technical-documentation.md",
      "required": false,
      "requires": [
        "core/semantic-naming"
      ],
      "sha256": "22a3325883a37df48f5d0040c18be8c5fdc6079315265d733a540d0efc38d1ba",
      "version": "0.1.0"
    },
    {
      "applies_to": [
        "**/*"
      ],
      "description": "Load when generating or reviewing diagrams, interactive views, presentations, simulations, or video that explain engineering facts",
      "id": "documentation/derived-explanations",
      "path": "specification/documentation/derived-explanations.md",
      "required": false,
      "requires": [
        "documentation/technical-documentation"
      ],
      "sha256": "e4ce1cab5143b645185854781de93f6e5e5416c6be3faad2aa14a2cadc864ec8",
      "version": "0.1.1"
    }
  ]
}
